product_id,sku_slug,brand_en,brand_ar,display_en_name,display_ar_name,short_ar_name,category,sub_category,product_step,layer_order,routine_time,is_core_routine_step,is_add_on,primary_concern,secondary_concern,tertiary_concern,skin_type_fit,best_for_ar,routine_tags,quiz_skin_type_tags,quiz_concern_tags,skin_code_tags,default_priority_score,same_step_choice_group,am_default,pm_default,selection_rule_ar,ar_product_title_seo,en_product_title_seo,en_short_hook,ar_long_description,en_long_description,ar_key_benefits,en_key_benefits,texture_ar,texture_en,why_kcode_ar,why_kcode_en,how_to_use_ar,how_to_use_en,usage_frequency_ar,active_strength_level Low / Medium / High,safety_notes_ar,safety_notes_en,avoid_pairing_same_routine,developer_output_rule,show_alternatives_button,remove_if_customer_has_it,source_url,data_confidence,needs_manual_check,seo_meta_title_ar,meta_description_en,meta_description_ar,primary_keyword_en,primary_keyword_ar,secondary_keywords_en,secondary_keywords_ar,final_url_slug,image_alt_en,image_alt_ar,og_title_ar,og_description_en,og_description_ar,pdp_headline_en,above_fold_hook_en,primary_badge_en,primary_badge_ar,result_promise_en,result_promise_ar,objection_answer_en,objection_answer_ar,routine_reason_en,routine_reason_ar,bundle_cta_en,bundle_cta_ar,add_to_cart_microcopy_en,add_to_cart_microcopy_ar,max_default_products_per_step,selection_weight_formula_note,selection_priority_tie_breaker,exclusion_rule,conflict_rule_strictness,pairing_rule,alternative_button_rule,add_on_display_rule,routine_builder_note,fallback_product_rule,show_in_default_quiz_result,Keywords,Problem Tag,Result Tag,Conflict Rules,Routine Role
product_id,medicube-zero-pore-pads-2-0-70-pads,Medicube,ميديكيوب,Medicube Zero Pore Pads 2.0 (70 pads),باد تونر ميديكيوب لتنقية المسام وتحسين نعومة البشرة (70 pads),باد تونر للمسام,Toner,Toner Pad,Toner ,2,PM,Yes,No,Pores,Oil Control,Smooth Texture,"Oily, Combination",مناسب لمن يعاني من مشاكل المسام ويرغب بروتين كوري واضح,"Pore Care, Oil Control","Oily, Combination","Pores, Oil Control",Pore Reset Code,95,TONER_PORES,No,Yes,اختر هذا المنتج عندما تكون أولوية العميل: Pores، مع مطابقة نوع البشرة ودرجة القوة.Select when pores are primary concern with oily/combination skin.,باد تونر ميديكيوب لتنقية المسام وتحسين نعومة البشرة (70 pads) | KCODE,Medicube Zero Pore Pads 2.0 (70 pads) | KCODE,Clear pores. Smoother skin in one swipe.,باد تونر عملي مصمم لتنظيف المسام بلطف وتحسين ملمس البشرة دون تقشير قاسٍ. يحتوي على أحماض خفيفة تساعد على إزالة الشوائب وتقليل مظهر المسام تدريجياً، ما يمنح البشرة مظهراً أنعم وأكثر توازناً.,Pre-soaked toner pads designed to gently clear pores and smooth skin texture without harsh exfoliation. Formulated with mild acids to remove buildup and refine pores over time.,ينظف المسام بلطف | يساعد على تقليل مظهر المسام | يحسن ملمس البشرة | مناسب للبشرة الدهنية والمختلطة,Gently clears pores | Helps reduce the look of pores | Improves skin texture | Ideal for oily and combination skin,باد مشبع بالتونر,Pre-soaked toner pads,اخترناه لأنه يجمع بين تقشير خفيف وسهولة الاستخدام (Pads)، مما يجعله خطوة فعالة وسريعة لتحسين مظهر المسام ضمن روتين يومي.,"Selected for combining mild exfoliation with easy-to-use pads, making it a practical and effective pore-care step.",بعد تنظيف البشرة، امسحي الوجه بلطف باستخدام الباد مع تجنب منطقة العين، ولا يُشطف.,"After cleansing, gently swipe the pad across the face avoiding the eye area. Do not rinse.",يومياً أو يوم بعد يوم حسب تحمل البشرة,,ابدأ باستخدامه 3–4 مرات أسبوعياً إذا كانت بشرتك حساسة. تجنب استخدامه مع مقشرات قوية أو ريتينول في نفس الروتين.,Start 3–4 times per week if you have sensitive skin. Avoid combining with strong exfoliants or retinol.,-,Return this product only if it is the highest-scoring match for its routine step.,Yes,Yes,User-provided product list,High,No,باد ميديكيوب للمسام (70 pads) | KCODE,"Korean toner pads by Medicube designed to clear pores, control oil, and smooth skin texture. Easy daily step for oily and combination skin.",باد تونر كوري يساعد على تنظيف المسام وتحسين نعومة البشرة. (70 pads) ضمن اختيارات KCODE للعناية بـالبشرة بأسلوب كوري ذكي ومناسب للروتين اليومي.,"korean toner pads for pores, medicube pore care","عناية كورية للمسام, ميديكيوب","korean skincare for pores, medicube pore care product, pore tightening korean skincare","عناية كورية للمسام, منتجات ميديكيوب, روتين كوري للبشرة",medicube-zero-pore-pads-2-0-70-pads,Medicube Zero Pore Pads 2.0 (70 pads) product image,صورة باد تونر ميديكيوب لتنقية المسام وتحسين ملمس البشرة (70 pads),باد تونر ميديكيوب لتنقية المسام وتحسين ملمس البشرة (70 pads),"Medicube Zero Pore Pads 2.0 (70 pads) is a curated KCODE pick for pores, designed to fit a smart Korean skincare routine.",باد تونر ميديكيوب لتنقية المسام وتحسين ملمس البشرة (70 pads) ضمن اختيارات KCODE للعناية بـPores بأسلوب كوري ذكي ومناسب للروتين اليومي.,Clear pores. Smooth your skin.,Clear pores. Smoother skin in one swipe.,Pore Care,عناية بالمسام,Visibly smoother skin and refined pores with consistent use.,بشرة أنعم ومسام أقل وضوحاً مع الاستخدام المنتظم.,"Gentle enough for regular use, with flexible frequency based on skin sensitivity.",لطيف على البشرة ويمكن استخدامه بانتظام مع تعديل التكرار حسب حساسية البشرة.,Fits the Pore Reset Code as a Toner Pads step.,يناسب Pore Reset Code كخطوة Toner Pads داخل الروتين.,Add the full routine,أضف الروتين الكامل,Add to my routine,أضف إلى روتيني,1,score = concern match + skin fit + priority - conflict penalty,"Higher priority score, then core step, then lower active strength for default quiz.",-,Standard,Pair with moisturizer and sunscreen,Show alternatives from same alternative_group only,Can show as default core step,Use as step 2 in PM routine. Select max 1 per same_step_choice_group.,"If excluded by sensitivity or conflict, use a Mild alternative in the same concern group.",Yes,"korean skincare for pores, medicube pore care product, pore tightening,korean skincare pore pads korean skincare, medicube toner pads, pore tightening pads",Pores,Smooth Texture,"Avoid combining with AHA/BHA exfoliants, retinol, or peeling products in the same routine.",Core
KCODE-P002,anua-niacinamide-10-plus-txa-4-serum-30ml,ANUA,أنوا,ANUA Niacinamide 10% + TXA 4% Serum (30ml),سيروم أنوا بتركيبة النياسيناميد وحمض الترانيكساميك لتفتيح البقع وتوحيد لون البشرة (30ml),سيروم تفتيح,Serum,Treatment Serum,Serum,3,AM/PM,Yes,No,Dark Spots,Glow,Brightening,All,مناسب لمن يبحث عن Dark Spots مع روتين كوري واضح.,"Brightening, Glow",All,"Dark Spots, Glow",Brightening Code,95,SERUM_DARK_SPOTS,Yes,Yes,اختر هذا المنتج عندما تكون أولوية العميل: Dark Spots، مع مطابقة نوع البشرة ودرجة القوة.,سيروم أنوا بتركيبة النياسيناميد وحمض الترانيكساميك لتفتيح البقع وتوحيد لون البشرة (30ml) | KCODE,ANUA Niacinamide 10% + TXA 4% Serum (30ml) | KCODE,Fade dark spots. Even your skin tone.,سيروم مركز يحتوي على النياسيناميد وحمض الترانيكساميك، مصمم لاستهداف التصبغات وتوحيد لون البشرة تدريجياً. يساعد على تقليل مظهر البقع الداكنة وتعزيز الإشراقة.,A concentrated serum with niacinamide and tranexamic acid designed to target dark spots and uneven skin tone while boosting radiance.,يساعد على تقليل التصبغات | يوحد لون البشرة | يعزز الإشراقة | مناسب لجميع أنواع البشرة,Targets dark spots | Evens skin tone | Boosts radiance | Suitable for all skin types,سيروم خفيف سريع الامتصاص,Lightweight fast-absorbing serum,اخترناه لأنه يقدم تركيبة فعالة للتصبغات تعتمد على النياسيناميد والترانيكساميك بدون تهيج قوي.,Selected for its balanced brightening formula that targets dark spots without harsh irritation.,يوضع بعد التونر وقبل الكريم. ابدأ تدريجياً خاصة إذا كانت بشرتك حساسة.,Apply after toner and before moisturizer. Introduce gradually if sensitive.,يومياً أو يوم بعد يوم حسب تحمل البشرة,,ابدأ باستخدامه 3–4 مرات أسبوعياً. تجنب دمجه مع مقشرات قوية إذا كانت بشرتك حساسة.,Start 3–4 times per week. Avoid combining with strong exfoliants if sensitive.,-,Return this product only if it is the highest-scoring match for its routine step.,Yes,Yes,User-provided product list,High,No,سيروم أنوا للتصبغات | KCODE,Korean brightening serum with niacinamide and tranexamic acid to reduce dark spots and even skin tone. Lightweight and effective for daily use.,سيروم أنوا بتركيبة النياسيناميد وحمض الترانيكساميك لتفتيح البقع وتوحيد لون البشرة (30ml) ضمن اختيارات KCODE للعناية بـDark Spots بأسلوب كوري ذكي ومناسب للر,korean serum for dark spots,سيروم كوري للتصبغات,"korean serum for dark spots, anua brightening skincare, kbeauty products for pigmentation, niacinamide korean skincare","سيروم كوري للتصبغات, منتجات أنوا, روتين كوري للبشرة",anua-niacinamide-10-plus-txa-4-serum-30ml,ANUA Niacinamide 10% + TXA 4% Serum (30ml) product image,صورة سيروم أنوا بتركيبة النياسيناميد وحمض الترانيكساميك لتفتيح البقع وتوحيد لون البشرة (30ml),سيروم أنوا بتركيبة النياسيناميد وحمض الترانيكساميك لتفتيح ال,"ANUA Niacinamide 10% + TXA 4% Serum (30ml) is a curated KCODE pick for dark spots, designed to fit a smart Korean skincare routine.",سيروم أنوا بتركيبة النياسيناميد وحمض الترانيكساميك لتفتيح البقع وتوحيد لون البشرة (30ml) ضمن اختيارات KCODE للعناية بـDark Spots بأسلوب كوري ذكي ومناسب للر,Fade dark spots. Brighten your skin.,A focused formula to improve the look of dark spots and uneven tone.,Brightening Pick,اختيار للتفتيح,More even skin tone and reduced dark spots over time.,لون بشرة أكثر توحداً وتقليل واضح للتصبغات مع الاستخدام المنتظم.,Effective yet gentle formula suitable for gradual daily use.,تركيبة فعالة ولطيفة نسبياً، مناسبة للاستخدام التدريجي.,Fits the Brightening Code as a Serum step.,يناسب Brightening Code كخطوة Serum داخل الروتين.,Add the full routine,أضف الروتين الكامل,Add to my routine,أضف إلى روتيني,1,score = concern match + skin fit + priority - conflict penalty,"Higher priority score, then core step, then lower active strength for default quiz.",-,Standard,Pair with moisturizer and sunscreen,Show alternatives from same alternative_group only,Can show as default core step,Use as step 3 in AM/PM routine. Select max 1 per same_step_choice_group.,"If excluded by sensitivity or conflict, use a Mild alternative in the same concern group.",Yes,"korean serum for dark spots, anua brightening skincare, kbeauty products for pigmentation, niacinamide korean skincare,niacinamide serum korean, txa serum pigmentation, korean serum dark spots",Dark Spots,Brightening,Avoid combining with strong exfoliating acids or layering multiple active serums for sensitive skin.,Core
KCODE-P003,beauty-of-joseon-relief-sun-rice-plus-probiotics-spf50-plus-pa-plus-plus-plus-plus-50ml,Beauty of Joseon,بيوتي أوف جوسون,Beauty of Joseon Relief Sun: Rice + Probiotics SPF50+ PA++++ (50ml),واقي شمس بيوتي أوف جوسون بتركيبة الأرز والبروبيوتكس لحماية يومية وإشراقة طبيعية (50ml),واقي شمس يومي,Sunscreen,Daily Protection,Sunscreen,6,AM,Yes,No,UV Protection,Glow,Daily Protection,"All, Sensitive",مناسب لمن يبحث عن UV Protection مع روتين كوري واضح.,"Daily, Glass Skin","All, Sensitive","UV Protection, Glow",Daily Shield Code,95,SUNSCREEN_UV_PROTECTION,Yes,No,اختر هذا المنتج عندما تكون أولوية العميل: UV Protection، مع مطابقة نوع البشرة ودرجة القوة.,واقي شمس بيوتي أوف جوسون بتركيبة الأرز والبروبيوتكس لحماية يومية وإشراقة طبيعية (50ml) | KCODE,Beauty of Joseon Relief Sun: Rice + Probiotics SPF50+ PA++++ (50ml) | KCODE,"Lightweight daily protection for a healthy, comfortable finish.",منتج مختار بعناية ضمن نظام KCODE ليمنح البشرة عناية فعالة ومريحة حسب احتياجها، مع تركيز واضح على UV Protection بدون مبالغة أو تعقيد.,"A curated KCODE skincare step designed to support uv protection with a balanced, easy-to-use routine approach.",يساعد على حماية البشرة من أشعة الشمس | ملمس مريح مناسب للاستخدام اليومي | يدعم مظهر الإشراقة الطبيعية,Helps protect against UV exposure | Comfortable daily texture | Supports a naturally radiant finish,ملمس خفيف سريع الامتصاص,"Lightweight, fast-absorbing",اخترناه لأنه يقدم قيمة واضحة في UV Protection ضمن روتين KCODE بدون تعقيد أو مبالغة.,"Selected by KCODE because it gives a clear role for uv protection within a simple, guided routine.",يوضع صباحاً كآخر خطوة في الروتين، مع إعادة التطبيق خلال اليوم عند الحاجة.,Apply every morning as the final skincare step. Reapply as needed.,يومي صباحاً,,إعادة التطبيق ضرورية عند التعرض الطويل للشمس.,Reapplication is important during prolonged sun exposure.,-,Return this product only if it is the highest-scoring match for its routine step.,Yes,Yes,User-provided product list,High,No,واقي شمس بيوتي أوف جوسون SPF50+ | KCODE,"Beauty of Joseon Relief Sun: Rice + Probiotics SPF50+ PA++++ (50ml) is a curated KCODE pick for uv protection, designed to fit a smart Korean skincare rout",واقي شمس بيوتي أوف جوسون بتركيبة الأرز والبروبيوتكس لحماية يومية وإشراقة طبيعية (50ml) ضمن اختيارات KCODE للعناية بـUV Protection بأسلوب كوري ذكي ومناسب لل,best korean sunscreen for daily use,واقي شمس كوري,"best korean sunscreen for daily use, beauty of joseon sunscreen, korean sunscreen no white cast, rice korean skincare","واقي شمس كوري, منتجات بيوتي أوف جوسون, روتين كوري للبشرة",beauty-of-joseon-relief-sun-rice-plus-probiotics-spf50-plus-pa-plus-plus-plus-plus-50ml,Beauty of Joseon Relief Sun: Rice + Probiotics SPF50+ PA++++ (50ml) product image,صورة واقي شمس بيوتي أوف جوسون بتركيبة الأرز والبروبيوتكس لحماية يومية وإشراقة طبيعية (50ml),واقي شمس بيوتي أوف جوسون بتركيبة الأرز والبروبيوتكس لحماية ي,"Beauty of Joseon Relief Sun: Rice + Probiotics SPF50+ PA++++ (50ml) is a curated KCODE pick for uv protection, designed to fit a smart Korean skincare rout",واقي شمس بيوتي أوف جوسون بتركيبة الأرز والبروبيوتكس لحماية يومية وإشراقة طبيعية (50ml) ضمن اختيارات KCODE للعناية بـUV Protection بأسلوب كوري ذكي ومناسب لل,"Lightweight daily protection for a healthy, comfortable finish.","Lightweight daily protection for a healthy, comfortable finish.",Daily SPF,حماية يومية,Supports visible improvement in uv protection.,يساعد على تحسين مظهر UV Protection ضمن روتين منتظم.,Designed to fit a guided routine; use gradually if your skin is sensitive.,مصمم ليدخل ضمن روتين واضح؛ ابدأ تدريجياً إذا كانت بشرتك حساسة.,Fits the Daily Shield Code as a Sunscreen step.,يناسب Daily Shield Code كخطوة Sunscreen داخل الروتين.,Add the full routine,أضف الروتين الكامل,Add to my routine,أضف إلى روتيني,1,score = concern match + skin fit + priority - conflict penalty,"Higher priority score, then core step, then lower active strength for default quiz.",-,Standard,Pair according to routine step,Show alternatives from same alternative_group only,Can show as default core step,Use as step 6 in AM routine. Select max 1 per same_step_choice_group.,"If excluded by sensitivity or conflict, use a Mild alternative in the same concern group.",Yes,"best korean sunscreen for daily use, beauty of joseon sunscreen, korean sunscreen no white cast, rice korean skincare",UV Protection,Daily Protection,-,Core
KCODE-P004,skin1004-madagascar-centella-hyalu-cica-water-fit-sun-serum-spf50-plus-pa-plus-plus-plus-plus-50ml,SKIN1004,سكِن1004,SKIN1004 Madagascar Centella Hyalu-Cica Water-Fit Sun Serum SPF50+ PA++++ (50ml),واقي شمس سكِن1004 بتركيبة السينتيلا والهيالو-سيكا لحماية يومية وإشراقة طبيعية (50ml),واقي شمس يومي,Sunscreen,Hydrating Sunscreen,Sunscreen Serum,6,AM,Yes,No,UV Protection,Hydration,Daily Protection,"All, Sensitive",مناسب لمن يبحث عن UV Protection مع روتين كوري واضح.,"Daily, Glass Skin","All, Sensitive","UV Protection, Hydration",Daily Shield Code,87,SUNSCREEN_UV_PROTECTION,Yes,No,اختر هذا المنتج عندما تكون أولوية العميل: UV Protection، مع مطابقة نوع البشرة ودرجة القوة.,واقي شمس سكِن1004 بتركيبة السينتيلا والهيالو-سيكا لحماية يومية وإشراقة طبيعية (50ml) | KCODE,SKIN1004 Madagascar Centella Hyalu-Cica Water-Fit Sun Serum SPF50+ PA++++ (50ml) | KCODE,"Lightweight daily protection for a healthy, comfortable finish.",منتج مختار بعناية ضمن نظام KCODE ليمنح البشرة عناية فعالة ومريحة حسب احتياجها، مع تركيز واضح على UV Protection بدون مبالغة أو تعقيد.,"A curated KCODE skincare step designed to support uv protection with a balanced, easy-to-use routine approach.",يساعد على حماية البشرة من أشعة الشمس | ملمس مريح مناسب للاستخدام اليومي | يدعم مظهر الإشراقة الطبيعية,Helps protect against UV exposure | Comfortable daily texture | Supports a naturally radiant finish,ملمس خفيف سريع الامتصاص,"Lightweight, fast-absorbing",اخترناه لأنه يقدم قيمة واضحة في UV Protection ضمن روتين KCODE بدون تعقيد أو مبالغة.,"Selected by KCODE because it gives a clear role for uv protection within a simple, guided routine.",يوضع صباحاً كآخر خطوة في الروتين، مع إعادة التطبيق خلال اليوم عند الحاجة.,Apply every morning as the final skincare step. Reapply as needed.,يومي صباحاً,,إعادة التطبيق ضرورية عند التعرض الطويل للشمس.,Reapplication is important during prolonged sun exposure.,-,Return this product only if it is the highest-scoring match for its routine step.,Yes,Yes,User-provided product list,High,No,واقي شمس سكِن1004 SPF50+ | KCODE,"SKIN1004 Madagascar Centella Hyalu-Cica Water-Fit Sun Serum SPF50+ PA++++ (50ml) is a curated KCODE pick for uv protection, designed to fit a smart Korean ",واقي شمس سكِن1004 بتركيبة السينتيلا والهيالو-سيكا لحماية يومية وإشراقة طبيعية (50ml) ضمن اختيارات KCODE للعناية بـUV Protection بأسلوب كوري ذكي ومناسب للرو,best korean sunscreen for daily use,واقي شمس كوري,"best korean sunscreen for daily use, skin1004 sunscreen, korean sunscreen no white cast, centella korean skincare","واقي شمس كوري, منتجات سكِن1004, روتين كوري للبشرة",skin1004-madagascar-centella-hyalu-cica-water-fit-sun-serum-spf50-plus-pa-plus-plus-plus-plus-50ml,SKIN1004 Madagascar Centella Hyalu-Cica Water-Fit Sun Serum SPF50+ PA++++ (50ml) product image,صورة واقي شمس سكِن1004 بتركيبة السينتيلا والهيالو-سيكا لحماية يومية وإشراقة طبيعية (50ml),واقي شمس سكِن1004 بتركيبة السينتيلا والهيالو-سيكا لحماية يوم,"SKIN1004 Madagascar Centella Hyalu-Cica Water-Fit Sun Serum SPF50+ PA++++ (50ml) is a curated KCODE pick for uv protection, designed to fit a smart Korean ",واقي شمس سكِن1004 بتركيبة السينتيلا والهيالو-سيكا لحماية يومية وإشراقة طبيعية (50ml) ضمن اختيارات KCODE للعناية بـUV Protection بأسلوب كوري ذكي ومناسب للرو,"Lightweight daily protection for a healthy, comfortable finish.","Lightweight daily protection for a healthy, comfortable finish.",Daily SPF,حماية يومية,Supports visible improvement in uv protection.,يساعد على تحسين مظهر UV Protection ضمن روتين منتظم.,Designed to fit a guided routine; use gradually if your skin is sensitive.,مصمم ليدخل ضمن روتين واضح؛ ابدأ تدريجياً إذا كانت بشرتك حساسة.,Fits the Daily Shield Code as a Sunscreen Serum step.,يناسب Daily Shield Code كخطوة Sunscreen Serum داخل الروتين.,Add the full routine,أضف الروتين الكامل,Add to my routine,أضف إلى روتيني,1,score = concern match + skin fit + priority - conflict penalty,"Higher priority score, then core step, then lower active strength for default quiz.",-,Standard,Pair according to routine step,Show alternatives from same alternative_group only,Can show as default core step,Use as step 6 in AM routine. Select max 1 per same_step_choice_group.,"If excluded by sensitivity or conflict, use a Mild alternative in the same concern group.",Yes,"best korean sunscreen for daily use, skin1004 sunscreen, korean sunscreen no white cast, centella korean skincare",UV Protection,Daily Protection,-,Core
